{
  "schemaVersion": 1,
  "name": "input-smoke",
  "checkpoint": "interactive",
  "actions": [
    {
      "type": "wait_pc",
      "address": 33911
    },
    {
      "type": "key",
      "petscii": "\r"
    },
    {
      "type": "joystick",
      "port": 2,
      "value": 1,
      "durationInstructions": 20000
    },
    {
      "type": "joystick",
      "port": 2,
      "value": 0,
      "durationInstructions": 20000
    },
    {
      "type": "capture",
      "artifacts": ["registers", "display"]
    }
  ]
}
